{
  "decision": "allow",
  "evaluation_status": "complete",
  "determining_policies": [
    {
      "id": "baseline-resource-scope",
      "version": "2026-05-20"
    }
  ],
  "diagnostics": [
    {
      "code": "scope_allowed",
      "message": "Requested scopes are within the resource grant."
    }
  ]
}
